{
  "event": "feature_used",
  "product_id": "contract-test",
  "environment": "test",
  "release_sha": "test-sha",
  "occurred_at": "2026-10-06T12:00:00Z",
  "user_id": "opaque-user",
  "account_id": "opaque-account",
  "plan_id": null,
  "session_id": "corr-123",
  "feature": "contract_validation",
  "outcome": "success",
  "schema_version": "1.0"
}
